{"schema_version":"agent-research-report/2.0.0","run_id":"rrh-final-lock-regression-normal-research-20260909","invocation_id":"inv_d55eb1a631a79ca567927e79","status":"COMPLETE","agent":"runtime_company_analyst","scope":"SEC-AAA 的点时公司基本面与有限估值证据研究；决策截止为 2026-01-31T23:59:59Z。","claims":[{"claim_id":"claim_revenue","statement":"事实：TTM revenue 为 USD 1,000,000；evidence_id=ev-normal-revenue，source_id=fixture-filing-primary，as_of=2025-12-31T00:00:00Z，retrieved_at=2026-01-15T13:00:00Z。","kind":"FACT","evidence_refs":["ev-normal-revenue"],"assumption_ids":[]},{"claim_id":"claim_margin","statement":"事实：TTM operating margin 为 0.18；evidence_id=ev-normal-margin，source_id=fixture-filing-primary，as_of=2025-12-31T00:00:00Z，retrieved_at=2026-01-15T13:00:00Z。","kind":"FACT","evidence_refs":["ev-normal-margin"],"assumption_ids":[]},{"claim_id":"claim_debt_and_ratio","statement":"事实：total debt 为 USD 150,000；evidence_id=ev-normal-debt，source_id=fixture-filing-primary，as_of=2025-12-31T00:00:00Z，retrieved_at=2026-01-15T13:00:00Z。确定性计算显示 debt/revenue 为 0.15，使用 ev-normal-debt 为分子、ev-normal-revenue 为分母。","kind":"FACT","evidence_refs":["ev-normal-debt","ev-normal-revenue"],"assumption_ids":[]},{"claim_id":"claim_update","statement":"事实：管理层维持此前披露的产能计划；evidence_id=ev-normal-update，source_id=fixture-company-release，as_of=2026-01-20T14:00:00Z，retrieved_at=2026-01-20T14:01:00Z。","kind":"FACT","evidence_refs":["ev-normal-update"],"assumption_ids":[]},{"claim_id":"claim_business_interpretation","statement":"解释：18% 的 TTM 经营利润率与 0.15 的 debt/revenue 比率共同表明，截至各自披露时点，公司具备盈利能力且债务规模相对其收入不高；但现有证据不足以判断利润的可持续性、竞争壁垒或未来产能回报。","kind":"INTERPRETATION","evidence_refs":["ev-normal-margin","ev-normal-debt","ev-normal-revenue","ev-normal-update"],"assumption_ids":[]}],"assumptions":[],"counter_evidence_refs":[],"uncertainties":["收盘价为 USD 100；evidence_id=ev-normal-price，source_id=fixture-market-primary，as_of=2026-01-30T21:00:00Z，retrieved_at=2026-01-30T21:05:00Z。但未提供稀释后股数、市值、现金、自由现金流、每股盈利或可比估值，无法形成估值结论。","“维持产能计划”不等同于已执行、已融资或将产生预期回报。","收入、利润率和债务均为单一 TTM/期末观测，缺乏历史趋势与同业背景。"],"data_gaps":["缺少股数或市值，无法将 USD 100 的股价转换为企业或股权估值倍数。","缺少现金、净债务、利息负担、债务到期结构和流动性数据。","缺少收入增长、利润率趋势、自由现金流、资本开支、产能规模和预期回报数据。","缺少产品、客户集中度、竞争地位及行业需求的证据。"],"invalidation_conditions":["若后续可靠证据显示经营利润率显著低于 18% 或收入明显下降，则当前关于盈利能力的解释失效。","若后续可靠证据显示债务、或有负债或流动性压力显著高于已披露的 USD 150,000，则当前关于相对债务负担的解释失效。","若管理层撤回、推迟或无法融资执行产能计划，则该更新不再支持产能计划延续的事实表述。"],"confidence":0.68,"confidence_rationale":"核心财务数值来自新鲜的主文件类 fixture 证据，且债务收入比由确定性工具计算；但估值与商业质量所需的关键数据缺失，因此仅对事实与有限解释保持中等置信度。","skill_execution":[{"invocation_hash":"da8a171cd685303f6649315924a9b4cf2bb8a93ba56f2980c66f5146a9ab6f78","skill_name":"evidence-grounding","version":"2.0.0"},{"invocation_hash":"46d3b6919e441237115dc7c9706bf3b5693c3cf17f9cad40099cf75bdcb57285","skill_name":"company-research","version":"2.0.0"},{"invocation_hash":"b08052277adb384ca75f56f6df33844bdb72263613eb48bda8aacddf851ffac8","skill_name":"valuation","version":"2.0.0"}],"artifact_refs":["fixture-calculation:company_analyst_debt_to_revenue_20260909:6f9395d7b5309d6033ba1c228a8e795544888fd674ad7524d17f0c8b7eb24ccf"]}
